Date,Duration (hours),Category,Description of completed task,Challenges and/or next steps,Reflection
1/26/2026,1,Other,Attended the orientation meeting.,,
1/27/2026,0.6,Other,"Completed the Orientation Quiz. 
Created GitHub repository ""rate-my-spot"" and set up the Project Management Board. Configured columns (Todo, In Progress, Done), linked the board to the repo, and set visibility to Public.",,
1/29/2026,3,"Research, Training, Learning",Conducted technical research and drafted the initial database schema. ,.,
1/29/2026,2,Coding,"Initialized both the backend and frontend projects. 
Implemented 8 core backend entities (User, Spot, Post, etc.) ",Prepare for the implementation of the backend business logic and API endpoints,
,,Other,,,
,,Other,,,
,,Other,,,
